<?xml version="1.0" encoding="UTF-8"?>
<xs:schema xmlns:xs="http://www.w3.org/2001/XMLSchema">
    <xs:element name="documento">
        <xs:complexType>
            <xs:sequence>
                <xs:element name="datos">
                    <xs:complexType>
                        <xs:sequence>
                            <xs:element name="titulo" type="xs:string" />
                            <xs:element name="imagen">
                                <xs:complexType>
                                    <xs:attribute name="foto" use="required" />
                                </xs:complexType>
                            </xs:element>
                            <xs:element name="resumen">
                                <xs:complexType>
                                    <xs:sequence>
                                        <xs:element name="nombre" type="xs:string" />
                                        <xs:element name="numero" type="xs:string" />
                                        <xs:element name="validez" type="xs:string" />
                                        <xs:element name="credito" type="xs:string" />
                                    </xs:sequence>
                                </xs:complexType>
                            </xs:element>
                        </xs:sequence>
                    </xs:complexType>
                </xs:element>
                <xs:element name="piepagina">
                    <xs:complexType>
                        <xs:sequence>
                            <xs:element name="p" type="xs:string" />
                        </xs:sequence>
                    </xs:complexType>
                </xs:element>
            </xs:sequence>
        </xs:complexType>
    </xs:element>
</xs:schema>