<?xml version="1.0" encoding="UTF-8" standalone="yes"?>
<?xml-stylesheet type="text/css" href="index.css"?>

<!-- © Juan Galisteo | Todos los derechos reservados -->

<documento xmlns:xsi="http://www.w3.org/2001/XMLSchema-instance"
 xsi:noNamespaceSchemaLocation="index.xsd">
  <!-- DNI -->
  <datos>
    <titulo>Tarjeta de crédito</titulo>
    <imagen foto="fotodni"></imagen>
    <resumen>
      <nombre>Juan Bautista Galisteo Marqués</nombre>
      <numero>1033 3691 1963 1247</numero>
      <validez>Valido hasta: 12/25</validez>
      <credito>Debit</credito>
    </resumen>
  </datos>

  <!-- PIE DE PÁGINA -->
  <piepagina>
    <p>© Juan Galisteo | Trabajo de clase: Lenguajes de marcas - DAW</p>
  </piepagina>
</documento>
